{
  "type": "CORE:RecipeLink",
  "_blueprintPath_": "/plugins/view_selector/blueprints/DummyBlueprint",
  "initialUiRecipe": {
    "name": "AttributeSelector",
    "type": "CORE:UiRecipe",
    "plugin": "@development-framework/dm-core-plugins/view_selector",
    "config": {
      "type": "PLUGINS:dm-core-plugins/view_selector/AttributeSelectorConfig",
      "childTabsOnRender": true,
      "asSidebar": true,
      "items": [
        {
          "type": "PLUGINS:dm-core-plugins/view_selector/AttributeSelectorItem",
          "label": "Edit self",
          "view": {
            "type": "CORE:InlineRecipeViewConfig",
            "recipe": {
              "type": "CORE:UiRecipe",
              "name": "Edit",
              "description": "Default edit",
              "plugin": "@development-framework/dm-core-plugins/form"
            },
            "scope": "self",
            "eds_icon": "edit"
          }
        },
        {
          "type": "PLUGINS:dm-core-plugins/view_selector/AttributeSelectorItem",
          "label": "Yaml view",
          "view": {
            "type": "CORE:InlineRecipeViewConfig",
            "recipe": {
              "type": "CORE:UiRecipe",
              "name": "Yaml",
              "description": "Yaml view",
              "plugin": "@development-framework/dm-core-plugins/yaml"
            },
            "scope": "self"
          }
        },
        {
          "type": "PLUGINS:dm-core-plugins/view_selector/AttributeSelectorItem",
          "label": "Diagram",
          "view": {
            "type": "CORE:InlineRecipeViewConfig",
            "recipe": {
              "type": "CORE:UiRecipe",
              "name": "Diagram",
              "description": "Default diagram",
              "plugin": "@development-framework/dm-core-plugins/blueprint-hierarchy"
            },
            "scope": "self"
          }
        },
        {
          "type": "PLUGINS:dm-core-plugins/view_selector/AttributeSelectorItem",
          "label": "List",
          "view": {
            "type": "CORE:InlineRecipeViewConfig",
            "recipe": {
              "name": "List",
              "type": "CORE:UiRecipe",
              "plugin": "@development-framework/dm-core-plugins/generic-list",
              "dimensions": "*"
            },
            "scope": "self"
          }
        }
      ]
    }
  },
  "uiRecipes": [
    {
      "name": "Yaml",
      "type": "CORE:UiRecipe",
      "plugin": "@development-framework/dm-core-plugins/yaml"
    },
    {
      "type": "CORE:UiRecipe",
      "name": "Edit",
      "description": "Default blueprint edit",
      "plugin": "@development-framework/dm-core-plugins/blueprint"
    },
    {
      "name": "Diagram",
      "type": "CORE:UiRecipe",
      "plugin": "@development-framework/dm-core-plugins/blueprint-hierarchy"
    }
  ]
}
