{
  "type": "CORE:RecipeLink",
  "_blueprintPath_": "/plugins/header/roles_header_example/blueprints/Person",
  "initialUiRecipe": {
    "name": "RoleFilter",
    "type": "CORE:UiRecipe",
    "config": {
      "type": "PLUGINS:dm-core-plugins/role_filter/RoleFilterConfig",
      "viewConfigs": [
        {
          "type": "CORE:ReferenceViewConfig",
          "recipe": "AdminHeader",
          "roles": ["dmss-admin", "developer"]
        },
        {
          "type": "CORE:ReferenceViewConfig",
          "recipe": "OperatorHeader",
          "roles": ["operator"]
        },
        {
          "type": "CORE:ReferenceViewConfig",
          "recipe": "Yaml"
        }
      ]
    },
    "plugin": "@development-framework/dm-core-plugins/role_filter"
  },
  "uiRecipes": [
    {
      "name": "AdminHeader",
      "type": "CORE:UiRecipe",
      "config": {
        "type": "PLUGINS:dm-core-plugins/header/HeaderPluginConfig",
        "hideAbout": false,
        "hideUserInfo": true,
        "uiRecipesList": ["Yaml", "Edit", "Explorer"]
      },
      "plugin": "@development-framework/dm-core-plugins/header"
    },
    {
      "name": "OperatorHeader",
      "type": "CORE:UiRecipe",
      "config": {
        "type": "PLUGINS:dm-core-plugins/header/HeaderPluginConfig",
        "hideAbout": false,
        "hideUserInfo": true,
        "uiRecipesList": ["Yaml", "Explorer"]
      },
      "plugin": "@development-framework/dm-core-plugins/header"
    },
    {
      "name": "Yaml",
      "type": "CORE:UiRecipe",
      "plugin": "@development-framework/dm-core-plugins/yaml"
    },
    {
      "name": "Edit",
      "type": "CORE:UiRecipe",
      "description": "Default edit",
      "plugin": "@development-framework/dm-core-plugins/form"
    },
    {
      "name": "Explorer",
      "type": "CORE:UiRecipe",
      "plugin": "@development-framework/dm-core-plugins/explorer"
    }
  ]
}
