{
  "type": "CORE:RecipeLink",
  "_blueprintPath_": "/plugins/form/example/blueprints/NestedExample",
  "initialUiRecipe": {
    "name": "AttributeSelector",
    "type": "CORE:UiRecipe",
    "plugin": "@development-framework/dm-core-plugins/view_selector",
    "config": {
      "type": "PLUGINS:dm-core-plugins/view_selector/AttributeSelectorConfig",
      "childTabsOnRender": true,
      "asSidebar": false,
      "items": [
        {
          "type": "PLUGINS:dm-core-plugins/view_selector/AttributeSelectorItem",
          "view": {
            "type": "CORE:InlineRecipeViewConfig",
            "recipe": {
              "type": "CORE:UiRecipe",
              "name": "Edit",
              "description": "Default edit",
              "plugin": "@development-framework/dm-core-plugins/form"
            },
            "scope": "self"
          }
        }
      ]
    }
  },
  "uiRecipes": [
    {
      "name": "custom",
      "type": "CORE:UiRecipe",
      "plugin": "@development-framework/dm-core-plugins/yaml",
      "category": "view"
    },
    {
      "name": "Form",
      "type": "CORE:UiRecipe",
      "plugin": "@development-framework/dm-core-plugins/form",
      "category": "edit"
    },
    {
      "name": "aRecipeName",
      "type": "CORE:UiRecipe",
      "plugin": "@development-framework/dm-core-plugins/form",
      "category": "edit",
      "config": {
        "type": "PLUGINS:dm-core-plugins/form/FormInput",
        "attributes": [
          {
            "type": "PLUGINS:dm-core-plugins/form/fields/StringField",
            "name": "bar",
            "widget": "TextareaWidget"
          }
        ]
      }
    }
  ]
}
