{
  "type": "CORE:RecipeLink",
  "_blueprintPath_": "/apps/EmployeeApp/blueprints/Employee",
  "initialUiRecipe": {
    "name": "Edit",
    "type": "CORE:UiRecipe",
    "description": "Default edit",
    "config": {
      "type": "PLUGINS:dm-core-plugins/form/FormInput",
      "attributes": [
        {
          "name": "description",
          "type": "PLUGINS:dm-core-plugins/form/fields/StringField",
          "widget": "TextareaWidget"
        }
      ]
    },
    "plugin": "@development-framework/dm-core-plugins/form"
  },
  "uiRecipes": [
    {
      "name": "List",
      "type": "CORE:UiRecipe",
      "config": {
        "type": "PLUGINS:dm-core-plugins/list/ListPluginConfig",
        "functionality": {
          "type": "PLUGINS:dm-core-plugins/list/FunctionalityConfig",
          "delete": true,
          "expand": true,
          "open": true
        },
        "headers": ["name", "description"],
        "label": "Employee number",
        "labelByIndex": true
      },
      "dimensions": "*",
      "plugin": "@development-framework/dm-core-plugins/list"
    }
  ]
}
