{
  "type": "CORE:RecipeLink",
  "_blueprintPath_": "/plugins/grid/example/blueprints/Dashboard",
  "initialUiRecipe": {
    "name": "Dashboard",
    "type": "CORE:UiRecipe",
    "config": {
      "type": "PLUGINS:dm-core-plugins/grid/GridPluginConfig",
      "items": [
        {
          "type": "PLUGINS:dm-core-plugins/grid/GridItem",
          "gridArea": {
            "type": "PLUGINS:dm-core-plugins/grid/GridArea",
            "columnEnd": 6,
            "columnStart": 1,
            "rowEnd": 1,
            "rowStart": 1
          },
          "viewConfig": {
            "type": "CORE:ReferenceViewConfig",
            "recipe": "aRecipeName",
            "scope": "aNestedObjectWithCustomUI"
          }
        },
        {
          "type": "PLUGINS:dm-core-plugins/grid/GridItem",
          "gridArea": {
            "type": "PLUGINS:dm-core-plugins/grid/GridArea",
            "columnEnd": 6,
            "columnStart": 4,
            "rowEnd": 2,
            "rowStart": 2
          },
          "viewConfig": {
            "type": "CORE:InlineRecipeViewConfig",
            "recipe": {
              "name": "form",
              "type": "CORE:UiRecipe",
              "config": {
                "type": "PLUGINS:dm-core-plugins/form/FormInput",
                "attributes": [
                  {
                    "name": "bar",
                    "type": "PLUGINS:dm-core-plugins/form/fields/StringField",
                    "widget": "TextareaWidget"
                  }
                ]
              },
              "plugin": "@development-framework/dm-core-plugins/form"
            },
            "scope": "aNestedObjectWithCustomUI"
          }
        },
        {
          "type": "PLUGINS:dm-core-plugins/grid/GridItem",
          "gridArea": {
            "type": "PLUGINS:dm-core-plugins/grid/GridArea",
            "columnEnd": 3,
            "columnStart": 1,
            "rowEnd": 4,
            "rowStart": 4
          },
          "viewConfig": {
            "type": "CORE:ReferenceViewConfig",
            "recipe": "Yaml",
            "scope": "orders[0].product"
          }
        },
        {
          "type": "PLUGINS:dm-core-plugins/grid/GridItem",
          "gridArea": {
            "type": "PLUGINS:dm-core-plugins/grid/GridArea",
            "columnEnd": 6,
            "columnStart": 4,
            "rowEnd": 4,
            "rowStart": 4
          },
          "viewConfig": {
            "type": "CORE:ReferenceViewConfig",
            "recipe": "Form",
            "scope": "order.product"
          }
        },
        {
          "type": "PLUGINS:dm-core-plugins/grid/GridItem",
          "gridArea": {
            "type": "PLUGINS:dm-core-plugins/grid/GridArea",
            "columnEnd": 6,
            "columnStart": 1,
            "rowEnd": 5,
            "rowStart": 5
          },
          "viewConfig": {
            "type": "CORE:InlineRecipeViewConfig",
            "recipe": {
              "name": "Json",
              "type": "CORE:UiRecipe",
              "plugin": "@development-framework/dm-core-plugins/json"
            }
          }
        }
      ],
      "size": {
        "type": "PLUGINS:dm-core-plugins/grid/GridSize",
        "columns": 6,
        "rows": 5
      }
    },
    "plugin": "@development-framework/dm-core-plugins/grid"
  },
  "uiRecipes": [
    {
      "name": "Yaml",
      "type": "CORE:UiRecipe",
      "plugin": "@development-framework/dm-core-plugins/yaml"
    },
    {
      "name": "Edit",
      "type": "CORE:UiRecipe",
      "plugin": "@development-framework/dm-core-plugins/form"
    }
  ]
}
