{
  "type": "CORE:RecipeLink",
  "_blueprintPath_": "/plugins/form/enums/blueprints/Enums",
  "initialUiRecipe": {
    "name": "ViewSelector",
    "type": "CORE:UiRecipe",
    "config": {
      "type": "PLUGINS:dm-core-plugins/view_selector/ViewSelectorConfig",
      "childTabsOnRender": true,
      "items": [
        {
          "type": "PLUGINS:dm-core-plugins/view_selector/ViewSelectorItem",
          "label": "Enums",
          "viewConfig": {
            "type": "CORE:ReferenceViewConfig",
            "recipe": "Enums"
          }
        },
        {
          "type": "PLUGINS:dm-core-plugins/view_selector/ViewSelectorItem",
          "label": "Yaml",
          "viewConfig": {
            "type": "CORE:InlineRecipeViewConfig",
            "recipe": {
              "name": "Yaml",
              "type": "CORE:UiRecipe",
              "description": "Yaml view",
              "plugin": "@development-framework/dm-core-plugins/yaml",
              "showRefreshButton": true
            },
            "scope": "self"
          }
        }
      ]
    },
    "plugin": "@development-framework/dm-core-plugins/view_selector/tabs"
  },
  "uiRecipes": [
    {
      "name": "Enums",
      "type": "CORE:UiRecipe",
      "config": {
        "type": "PLUGINS:dm-core-plugins/form/FormInput",
        "attributes": [
          {
            "name": "singleString",
            "type": "PLUGINS:dm-core-plugins/form/fields/StringField",
            "config": {
              "type": "PLUGINS:dm-core-plugins/form/widgets/SelectWidgetConfig",
              "multiline": false
            },
            "widget": "SelectWidget"
          },
          {
            "name": "manyStrings",
            "type": "PLUGINS:dm-core-plugins/form/fields/StringField",
            "config": {
              "type": "PLUGINS:dm-core-plugins/form/widgets/SelectWidgetConfig",
              "multiline": true
            },
            "widget": "SelectWidget"
          }
        ]
      },
      "plugin": "@development-framework/dm-core-plugins/form"
    }
  ]
}
