{
  "type": "CORE:RecipeLink",
  "_blueprintPath_": "/plugins/form/read_only/blueprints/Person",
  "initialUiRecipe": {
    "name": "ViewSelector",
    "type": "CORE:UiRecipe",
    "config": {
      "type": "PLUGINS:dm-core-plugins/view_selector/ViewSelectorConfig",
      "childTabsOnRender": true,
      "items": [
        {
          "type": "PLUGINS:dm-core-plugins/view_selector/ViewSelectorItem",
          "viewConfig": {
            "type": "CORE:InlineRecipeViewConfig",
            "recipe": {
              "name": "Edit",
              "type": "CORE:UiRecipe",
              "description": "Default edit",
              "plugin": "@development-framework/dm-core-plugins/form"
            },
            "scope": "self"
          }
        }
      ]
    },
    "plugin": "@development-framework/dm-core-plugins/view_selector/tabs"
  },
  "uiRecipes": [
    {
      "name": "defaultYaml",
      "type": "CORE:UiRecipe",
      "category": "view",
      "plugin": "@development-framework/dm-core-plugins/yaml"
    },
    {
      "name": "defaultForm",
      "type": "CORE:UiRecipe",
      "category": "edit",
      "config": {
        "type": "PLUGINS:dm-core-plugins/form/FormInput",
        "readOnly": true
      },
      "plugin": "@development-framework/dm-core-plugins/form"
    }
  ]
}
