{
  "type": "CORE:RecipeLink",
  "_blueprintPath_": "/plugins/grid/example/blueprints/Nested",
  "initialUiRecipe": {
    "name": "ViewSelector",
    "type": "CORE:UiRecipe",
    "config": {},
    "plugin": "@development-framework/dm-core-plugins/view_selector"
  },
  "uiRecipes": [
    {
      "name": "custom",
      "type": "CORE:UiRecipe",
      "category": "view",
      "plugin": "@development-framework/dm-core-plugins/yaml"
    },
    {
      "name": "Form",
      "type": "CORE:UiRecipe",
      "plugin": "@development-framework/dm-core-plugins/form"
    }
  ]
}
