{
  "type": "CORE:RecipeLink",
  "_blueprintPath_": "/plugins/view_selector/car_garage/blueprints/CarGarage",
  "initialUiRecipe": {
    "name": "ViewSelector",
    "type": "CORE:UiRecipe",
    "plugin": "@development-framework/dm-core-plugins/view_selector",
    "config": {
      "type": "PLUGINS:dm-core-plugins/view_selector/ViewSelectorConfig",
      "childTabsOnRender": true,
      "asSidebar": true,
      "items": [
        {
          "type": "PLUGINS:dm-core-plugins/view_selector/ViewSelectorItem",
          "view": {
            "type": "CORE:InlineRecipeViewConfig",
            "recipe": {
              "type": "CORE:UiRecipe",
              "name": "Garage",
              "description": "",
              "plugin": "@development-framework/dm-core-plugins/form",
              "config": {
                "type": "PLUGINS:dm-core-plugins/form/FormInput",
                "fields": ["name", "description"]
              }
            },
            "scope": "self",
            "eds_icon": "home"
          }
        },
        {
          "type": "PLUGINS:dm-core-plugins/view_selector/ViewSelectorItem",
          "view": {
            "type": "CORE:ReferenceViewConfig",
            "scope": "Audi",
            "eds_icon": "car"
          }
        },
        {
          "type": "PLUGINS:dm-core-plugins/view_selector/ViewSelectorItem",
          "view": {
            "type": "CORE:ReferenceViewConfig",
            "scope": "Volvo",
            "eds_icon": "car"
          }
        }
      ]
    }
  },
  "uiRecipes": [
    {
      "name": "Yaml",
      "type": "CORE:UiRecipe",
      "plugin": "@development-framework/dm-core-plugins/yaml"
    },
    {
      "type": "CORE:UiRecipe",
      "name": "Edit",
      "description": "Default edit",
      "plugin": "@development-framework/dm-core-plugins/form"
    }
  ]
}
