{
  "type": "CORE:RecipeLink",
  "_blueprintPath_": "blueprints/TabsAsSidebarBlueprint",
  "initialUiRecipe": {
    "name": "AttributeSelector",
    "type": "CORE:UiRecipe",
    "plugin": "@development-framework/dm-core-plugins/attribute-selector",
    "config": {
      "type": "blueprints/Plugins/AttributeSelectorPluginConfig",
      "childTabsOnRender": true,
      "asSidebar": true,
      "homeRecipe": "home"
    }
  },
  "uiRecipes": [
    {
      "type": "CORE:UiRecipe",
      "name": "home",
      "plugin": "UiPluginSelector",
      "config": {
        "type": "blueprints/Plugins/UiPluginSelectorConfig",
        "recipes": ["Yaml", "Edit"]
      }
    },
    {
      "name": "Yaml",
      "type": "CORE:UiRecipe",
      "plugin": "yaml",
      "category": "container"
    },
    {
      "type": "CORE:UiRecipe",
      "name": "Edit",
      "description": "Default edit",
      "plugin": "form"
    }
  ]
}
