{
  "type": "CORE:RecipeLink",
  "_blueprintPath_": "/plugins/list/order_example/blueprints/Order",
  "initialUiRecipe": {
    "name": "ViewSelector",
    "type": "CORE:UiRecipe",
    "plugin": "@development-framework/dm-core-plugins/view_selector/tabs",
    "config": {
      "type": "PLUGINS:dm-core-plugins/view_selector/ViewSelectorConfig",
      "childTabsOnRender": true
    }
  },
  "uiRecipes": [
    {
      "name": "Form",
      "type": "CORE:UiRecipe",
      "plugin": "@development-framework/dm-core-plugins/form"
    },
    {
      "name": "Yaml",
      "type": "CORE:UiRecipe",
      "plugin": "@development-framework/dm-core-plugins/yaml"
    },
    {
      "name": "List",
      "type": "CORE:UiRecipe",
      "plugin": "@development-framework/dm-core-plugins/list",
      "dimensions": "*",
      "config": {
        "type": "PLUGINS:dm-core-plugins/list/ListPluginConfig",
        "viewConfigs": [],
        "headers": [
          "name",
          "description"
        ],
        "openAsTab": true,
        "functionality": {
          "type": "PLUGINS:dm-core-plugins/list/FunctionalityConfig",
          "delete": true
        }
      }
    }
  ]
}
