{
  "type": "CORE:RecipeLink",
  "_blueprintPath_": "CORE:Blueprint",
  "initialUiRecipe": {
    "name": "UiPluginSelector",
    "type": "CORE:UiRecipe",
    "plugin": "UiPluginSelector",
    "config": {}
  },
  "uiRecipes": [
    {
      "name": "Yaml",
      "type": "CORE:UiRecipe",
      "plugin": "@development-framework/dm-core-plugins/yaml"
    },
    {
      "type": "CORE:UiRecipe",
      "name": "Edit",
      "description": "Default blueprint edit",
      "plugin": "@development-framework/dm-core-plugins/blueprint"
    },
    {
      "name": "Diagram",
      "type": "CORE:UiRecipe",
      "plugin": "@development-framework/dm-core-plugins/blueprint-hierarchy"
    }
  ]
}
