{
  "type": "CORE:RecipeLink",
  "_blueprintPath_": "AppModels:containers/EquallySpacedSignal",
  "initialUiRecipe": {
    "name": "UiRecipesSelector",
    "type": "CORE:UiRecipe",
    "plugin": "@development-framework/dm-core-plugins/attribute-selector",
    "config": {
      "type": "PLUGINS:dm-core-plugins/attribute-selector/AttributeSelectorConfig",
      "items": [
        {
          "type": "PLUGINS:dm-core-plugins/attribute-selector/AttributeSelectorItem",
          "label": "Plot",
          "view": {
            "type": "CORE:ReferenceViewConfig",
            "recipe": "Plot",
            "scope": "self"
          }
        },
        {
          "type": "PLUGINS:dm-core-plugins/attribute-selector/AttributeSelectorItem",
          "label": "Table",
          "view": {
            "type": "CORE:ReferenceViewConfig",
            "recipe": "Table",
            "scope": "self"
          }
        }
      ]
    }
  },
  "uiRecipes": [
    {
      "name": "Plot",
      "type": "CORE:UiRecipe",
      "plugin": "marmo-ess-plot-view"
    },
    {
      "name": "Table",
      "type": "CORE:UiRecipe",
      "plugin": "marmo-ess-table-view"
    },
    {
      "type": "CORE:UiRecipe",
      "name": "Edit",
      "description": "Default edit",
      "plugin": "@development-framework/dm-core-plugins/form"
    }
  ]
}
