{
  "type": "CORE:RecipeLink",
  "_blueprintPath_": "blueprints/AttributeSelectorSidebarBlueprint",
  "initialUiRecipe": {
    "name": "AttributeSelector",
    "type": "CORE:UiRecipe",
    "plugin": "@development-framework/dm-core-plugins/attribute-selector",
    "config": {
      "type": "PLUGINS:dm-core-plugins/attribute-selector/AttributeSelectorConfig",
      "childTabsOnRender": true,
      "asSidebar": true,
      "items": [
        {
          "type": "PLUGINS:dm-core-plugins/attribute-selector/AttributeSelectorItem",
          "view": {
            "type": "CORE:InlineRecipeViewConfig",
            "recipe": {
              "type": "CORE:UiRecipe",
              "name": "Edit",
              "description": "Default edit",
              "plugin": "@development-framework/dm-core-plugins/form"
            },
            "scope": "firstAttribute"
          }
        },
        {
          "type": "PLUGINS:dm-core-plugins/attribute-selector/AttributeSelectorItem",
          "view": {
            "type": "CORE:InlineRecipeViewConfig",
            "recipe": {
              "type": "CORE:UiRecipe",
              "name": "Edit",
              "description": "Default edit",
              "plugin": "@development-framework/dm-core-plugins/form"
            },
            "scope": "secondAttribute",
            "eds_icon": "edit"
          }
        },
        {
          "type": "PLUGINS:dm-core-plugins/attribute-selector/AttributeSelectorItem",
          "view": {
            "type": "CORE:InlineRecipeViewConfig",
            "recipe": {
              "type": "CORE:UiRecipe",
              "name": "Edit",
              "description": "Default edit",
              "plugin": "@development-framework/dm-core-plugins/form"
            },
            "scope": "thirdAttribute",
            "eds_icon": "apps"
          }
        }
      ]
    }
  },
  "uiRecipes": [
    {
      "type": "CORE:UiRecipe",
      "name": "home",
      "plugin": "recipe-selector"
    },
    {
      "name": "Yaml",
      "type": "CORE:UiRecipe",
      "plugin": "@development-framework/dm-core-plugins/yaml"
    },
    {
      "type": "CORE:UiRecipe",
      "name": "Edit",
      "description": "Default edit",
      "plugin": "@development-framework/dm-core-plugins/form"
    }
  ]
}
