{
  "type": "CORE:RecipeLink",
  "_blueprintPath_": "/apps/ExampleApplication/ExampleApplication",
  "initialUiRecipe": {
    "name": "Header",
    "type": "CORE:UiRecipe",
    "config": {
      "type": "PLUGINS:dm-core-plugins/header/HeaderPluginConfig",
      "hideAbout": false,
      "hideUserInfo": false,
      "uiRecipesList": ["Explorer", "Yaml"]
    },
    "plugin": "@development-framework/dm-core-plugins/header"
  },
  "uiRecipes": [
    {
      "name": "Explorer",
      "type": "CORE:UiRecipe",
      "plugin": "@development-framework/dm-core-plugins/explorer"
    },
    {
      "name": "Yaml",
      "type": "CORE:UiRecipe",
      "plugin": "@development-framework/dm-core-plugins/yaml"
    }
  ]
}
