{
  "type": "CORE:RecipeLink",
  "_blueprintPath_": "AppModels:signals_simple/Case",
  "initialUiRecipe": {
    "name": "UiRecipesSelector",
    "type": "CORE:UiRecipe",
    "config": {
      "type": "PLUGINS:dm-core-plugins/view_selector/ViewSelectorConfig",
      "items": [
        {
          "type": "PLUGINS:dm-core-plugins/view_selector/ViewSelectorItem",
          "label": "Tabs",
          "viewConfig": {
            "type": "CORE:ReferenceViewConfig",
            "recipe": "Tabs",
            "scope": "self"
          }
        },
        {
          "type": "PLUGINS:dm-core-plugins/view_selector/ViewSelectorItem",
          "label": "Run",
          "viewConfig": {
            "type": "CORE:ReferenceViewConfig",
            "recipe": "Run",
            "scope": "self"
          }
        }
      ]
    },
    "plugin": "@development-framework/dm-core-plugins/view_selector/tabs"
  },
  "uiRecipes": [
    {
      "name": "Yaml",
      "type": "CORE:UiRecipe",
      "plugin": "yaml-view"
    },
    {
      "name": "Tabs",
      "type": "CORE:UiRecipe",
      "config": {
        "type": "PLUGINS:dm-core-plugins/view_selector/ViewSelectorConfig",
        "childTabsOnRender": true
      },
      "plugin": "@development-framework/dm-core-plugins/view_selector/tabs"
    },
    {
      "name": "Edit",
      "type": "CORE:UiRecipe",
      "description": "Default edit",
      "plugin": "form"
    },
    {
      "name": "Run",
      "type": "CORE:UiRecipe",
      "description": "running",
      "plugin": "signal-job"
    }
  ]
}
