{
  "type": "CORE:RecipeLink",
  "_blueprintPath_": "_default_",
  "initialUiRecipe": {
    "name": "Tabs",
    "type": "CORE:UiRecipe",
    "config": {
      "type": "PLUGINS:dm-core-plugins/view_selector/ViewSelectorConfig",
      "childTabsOnRender": true
    },
    "plugin": "@development-framework/dm-core-plugins/view_selector/tabs"
  },
  "uiRecipes": [
    {
      "name": "Edit",
      "type": "CORE:UiRecipe",
      "description": "Default edit",
      "plugin": "@development-framework/dm-core-plugins/form"
    }
  ]
}
