{
  "type": "CORE:RecipeLink",
  "_blueprintPath_": "/plugins/view_selector/example/blueprints/ViewSelectorSidebar",
  "initialUiRecipe": {
    "name": "ViewSelector",
    "type": "CORE:UiRecipe",
    "plugin": "@development-framework/dm-core-plugins/view_selector",
    "config": {
      "type": "PLUGINS:dm-core-plugins/view_selector/ViewSelectorConfig",
      "childTabsOnRender": true,
      "asSidebar": true,
      "items": [
        {
          "type": "PLUGINS:dm-core-plugins/view_selector/ViewSelectorItem",
          "view": {
            "type": "CORE:InlineRecipeViewConfig",
            "recipe": {
              "name": "Edit",
              "type": "CORE:UiRecipe",
              "description": "Default edit",
              "plugin": "@development-framework/dm-core-plugins/form"
            },
            "scope": "firstAttribute"
          }
        },
        {
          "type": "PLUGINS:dm-core-plugins/view_selector/ViewSelectorItem",
          "view": {
            "type": "CORE:InlineRecipeViewConfig",
            "recipe": {
              "name": "Edit",
              "type": "CORE:UiRecipe",
              "description": "Default edit",
              "plugin": "@development-framework/dm-core-plugins/form"
            },
            "scope": "secondAttribute",
            "eds_icon": "edit"
          }
        },
        {
          "type": "PLUGINS:dm-core-plugins/view_selector/ViewSelectorItem",
          "view": {
            "type": "CORE:InlineRecipeViewConfig",
            "recipe": {
              "name": "Edit",
              "type": "CORE:UiRecipe",
              "description": "Default edit",
              "plugin": "@development-framework/dm-core-plugins/form"
            },
            "scope": "thirdAttribute",
            "eds_icon": "apps"
          }
        }
      ]
    }
  },
  "uiRecipes": [
    {
      "name": "Yaml",
      "type": "CORE:UiRecipe",
      "plugin": "@development-framework/dm-core-plugins/yaml"
    },
    {
      "name": "Edit",
      "type": "CORE:UiRecipe",
      "description": "Default edit",
      "plugin": "@development-framework/dm-core-plugins/form"
    }
  ]
}
