{
  "type": "CORE:RecipeLink",
  "_blueprintPath_": "AppModels:signals_simple/Study",
  "initialUiRecipe": {
    "name": "Tabs",
    "type": "CORE:UiRecipe",
    "plugin": "@development-framework/dm-core-plugins/attribute-selector",
    "config": {
      "type": "PLUGINS:dm-core-plugins/attribute-selector/AttributeSelectorConfig",
      "childTabsOnRender": true,
      "asSidebar": false,
      "items": [
        {
          "type": "PLUGINS:dm-core-plugins/attribute-selector/AttributeSelectorItem",
          "label": "Home",
          "view": {
            "type": "CORE:ReferenceViewConfig",
            "recipe": "Edit"
          }
        }
      ]
    }
  },
  "uiRecipes": [
    {
      "type": "CORE:UiRecipe",
      "name": "Edit",
      "description": "Default edit",
      "plugin": "@development-framework/dm-core-plugins/form"
    }
  ]
}
