{
  "type": "CORE:RecipeLink",
  "_blueprintPath_": "/plugins/grid/blueprints/OrderItem",
  "initialUiRecipe": {
    "name": "UiRecipesSelector",
    "type": "CORE:UiRecipe",
    "plugin": "@development-framework/dm-core-plugins/view_selector",
    "config": {
      "type": "PLUGINS:dm-core-plugins/view_selector/ViewSelectorConfig",
      "items": [
        {
          "type": "PLUGINS:dm-core-plugins/view_selector/ViewSelectorItem",
          "label": "Edit",
          "view": {
            "type": "CORE:InlineRecipeViewConfig",
            "recipe": {
              "type": "CORE:UiRecipe",
              "name": "Edit",
              "description": "Default edit",
              "plugin": "@development-framework/dm-core-plugins/form"
            },
            "scope": "self"
          }
        }
      ]
    }
  },
  "uiRecipes": [
    {
      "name": "Yaml",
      "type": "CORE:UiRecipe",
      "plugin": "@development-framework/dm-core-plugins/yaml"
    },
    {
      "name": "Form",
      "type": "CORE:UiRecipe",
      "plugin": "@development-framework/dm-core-plugins/form"
    },
    {
      "name": "List",
      "type": "CORE:UiRecipe",
      "plugin": "@development-framework/dm-core-plugins/generic_list",
      "dimensions": "*",
      "config": {
        "type": "PLUGINS:dm-core-plugins/generic_list/GenericListPluginConfig",
        "headers": ["name", "quantity", "type"],
        "functionality": {
          "type": "PLUGINS:dm-core-plugins/generic_list/FunctionalityConfig",
          "delete": true
        }
      }
    }
  ]
}
